{
  "schema_version": "1.0",
  "pr_id": "pr-1",
  "base": "main",
  "head": "demo/pr-1-quiz-signup",
  "facts_file": "reports/curbcut/pr-1/facts.json",
  "generated_by": "cc-review",
  "summary": {
    "proven": 12,
    "flagged": 11,
    "out_of_reach": 13,
    "not_scanned": 0
  },
  "findings": [
    {
      "id": "F001",
      "tier": "proven",
      "sc": "1.3.5",
      "title": "Invalid autocomplete attribute value on display-name field",
      "principle": "perceivable",
      "severity": "serious",
      "page": "quiz-signup.html",
      "selector": "#display-name",
      "fact_ids": ["axe-60dbbd10"],
      "reason": "The autocomplete attribute value 'nick-name' is not a valid HTML autocomplete keyword; the engine confirmed the value is incorrectly formatted.",
      "who_is_affected": "People with cognitive disabilities and motor impairments benefit from browser autofill, which requires correct autocomplete values.",
      "how_to_fix": "Change autocomplete='nick-name' to a valid token such as autocomplete='username' or autocomplete='name'.",
      "fixable": true,
      "understanding_url": "https://www.w3.org/WAI/WCAG22/Understanding/identify-input-purpose.html",
      "source": "subagent:perceivable"
    },
    {
      "id": "F002",
      "tier": "proven",
      "sc": "1.4.3",
      "title": "Hint text has insufficient color contrast",
      "principle": "perceivable",
      "severity": "serious",
      "page": "quiz-signup.html",
      "selector": "#signup-form > div:nth-of-type(1) > p",
      "fact_ids": ["axe-43c1c80f", "contr-7ad405bb"],
      "reason": "Hint text has foreground color #9a9a9a on background #ffffff with a contrast ratio of 2.81:1, below the required minimum of 4.5:1 for normal-weight text at 14.4px.",
      "who_is_affected": "People with low vision or color blindness struggle to read text that does not have sufficient contrast against its background.",
      "how_to_fix": "Change the hint text color to a darker shade that achieves at least 4.5:1 contrast against #ffffff; for example #767676 achieves exactly 4.5:1.",
      "fixable": true,
      "understanding_url": "https://www.w3.org/WAI/WCAG22/Understanding/contrast-minimum.html",
      "source": "subagent:perceivable"
    },
    {
      "id": "F003",
      "tier": "flagged",
      "sc": "1.1.1",
      "title": "Non-descriptive alt text on badge image",
      "principle": "perceivable",
      "severity": "serious",
      "page": "quiz-signup.html",
      "selector": ".quiz-badge img",
      "fact_ids": [],
      "reason": "The badge image has alt text 'image' which does not convey the purpose or meaning of the graphic (the Cell Explorer badge).",
      "who_is_affected": "Blind users and people who cannot see images rely on text alternatives to understand visual content; 'image' conveys nothing about the badge.",
      "how_to_fix": "Replace alt='image' with a descriptive alternative such as alt='Cell Explorer badge'.",
      "fixable": true,
      "understanding_url": "https://www.w3.org/WAI/WCAG22/Understanding/non-text-content.html",
      "source": "subagent:perceivable"
    },
    {
      "id": "F004",
      "tier": "flagged",
      "sc": "1.3.3",
      "title": "Form instruction relies on color and position to identify the submit button",
      "principle": "perceivable",
      "severity": "serious",
      "page": "quiz-signup.html",
      "selector": "#signup-form > p:nth-of-type(2)",
      "fact_ids": [],
      "reason": "The instruction 'When you are ready, press the green button on the right' identifies the control only by color (green) and screen position (right), with no text label or other identifier.",
      "who_is_affected": "Blind users and people with color blindness cannot rely on visual or spatial characteristics alone to identify controls.",
      "how_to_fix": "Replace the instruction with one that uses the button label, for example 'When you are ready, press Sign up'.",
      "fixable": true,
      "understanding_url": "https://www.w3.org/WAI/WCAG22/Understanding/sensory-characteristics.html",
      "source": "subagent:perceivable"
    },
    {
      "id": "F005",
      "tier": "flagged",
      "sc": "1.4.1",
      "title": "Form validation error state indicated by color only",
      "principle": "perceivable",
      "severity": "serious",
      "page": "quiz-signup.html",
      "selector": ".signup-form .invalid",
      "fact_ids": [],
      "reason": "Invalid form fields are indicated by changing the border to red (#d93025) and background to light red (#fdecea), with no text message, error icon, or aria-invalid attribute to convey the error state without color.",
      "who_is_affected": "People with color blindness or low vision cannot distinguish an error state indicated by color alone.",
      "how_to_fix": "Add a visible error message in text, set aria-invalid='true' on invalid fields, and link each field to its error message with aria-describedby.",
      "fixable": true,
      "understanding_url": "https://www.w3.org/WAI/WCAG22/Understanding/use-of-color.html",
      "source": "subagent:perceivable"
    },
    {
      "id": "F006",
      "tier": "flagged",
      "sc": "1.4.13",
      "title": "Help popups lack a keyboard-accessible dismiss mechanism",
      "principle": "perceivable",
      "severity": "moderate",
      "page": "quiz-signup.html",
      "selector": ".help-icon",
      "fact_ids": [],
      "reason": "Help buttons toggle hidden text panels on click but provide no Escape-key dismiss handler and no hover persistence, leaving keyboard and low-vision users unable to dismiss or re-read the content.",
      "who_is_affected": "Users with low vision who zoom in and users with motor disabilities often need to move the pointer to read tooltip content without it closing.",
      "how_to_fix": "Add an Escape key listener to dismiss open help panels and ensure pointer users can move onto the revealed content without it closing.",
      "fixable": true,
      "understanding_url": "https://www.w3.org/WAI/WCAG22/Understanding/content-on-hover-or-focus.html",
      "source": "subagent:perceivable"
    },
    {
      "id": "F007",
      "tier": "proven",
      "sc": "2.1.1",
      "title": "Submit button implemented as a div and is not keyboard accessible",
      "principle": "operable",
      "severity": "critical",
      "page": "quiz-signup.html",
      "selector": "#submit-signup",
      "fact_ids": ["click-4816a2a4"],
      "reason": "The submit control is a div with a click listener but is not focusable and is not a native interactive element, so keyboard-only users cannot reach or activate it.",
      "who_is_affected": "Keyboard-only users, switch access users, and screen reader users cannot use a mouse and depend entirely on keyboard access.",
      "how_to_fix": "Replace the div with a native <button type='submit'> element, which is focusable and keyboard-operable by default.",
      "fixable": true,
      "understanding_url": "https://www.w3.org/WAI/WCAG22/Understanding/keyboard.html",
      "source": "subagent:operable"
    },
    {
      "id": "F008",
      "tier": "proven",
      "sc": "2.1.2",
      "title": "Keyboard focus trap in the terms section",
      "principle": "operable",
      "severity": "critical",
      "page": "quiz-signup.html",
      "selector": "#terms-first",
      "fact_ids": ["focus-fca4a983"],
      "reason": "Repeated Tab presses cycle focus only between #terms-first and #terms-last; the #agree checkbox and a page link are unreachable by keyboard.",
      "who_is_affected": "Keyboard users become stuck in the terms section and cannot navigate to the rest of the form or complete the sign-up.",
      "how_to_fix": "Remove the keydown handlers that intercept Tab in the terms section. If modal-style focus containment is intended, implement it only while the modal is explicitly open and provide an Escape key to exit.",
      "fixable": true,
      "understanding_url": "https://www.w3.org/WAI/WCAG22/Understanding/no-keyboard-trap.html",
      "source": "subagent:operable"
    },
    {
      "id": "F009",
      "tier": "proven",
      "sc": "2.2.1",
      "title": "Meta refresh redirects the page after 5 minutes with no user control",
      "principle": "operable",
      "severity": "critical",
      "page": "quiz-signup.html",
      "selector": "meta[http-equiv=\"refresh\"]",
      "fact_ids": ["axe-a10cd7fe"],
      "reason": "The meta refresh tag forces a page redirect after 300 seconds with no mechanism for the user to turn off, adjust, or extend the time limit.",
      "who_is_affected": "People with cognitive or motor disabilities need more time to complete tasks and may be unable to finish the form before the page redirects.",
      "how_to_fix": "Remove the meta refresh tag. If a session timeout is required, replace it with a server-side mechanism that warns the user and offers options to extend the session.",
      "fixable": true,
      "understanding_url": "https://www.w3.org/WAI/WCAG22/Understanding/timing-adjustable.html",
      "source": "subagent:operable"
    },
    {
      "id": "F010",
      "tier": "proven",
      "sc": "2.4.7",
      "title": "Custom radio inputs have no visible focus indicator",
      "principle": "operable",
      "severity": "serious",
      "page": "quiz-signup.html",
      "selector": "#signup-form > div:nth-of-type(6) > div:nth-of-type(1) > label:nth-of-type(1) > input",
      "fact_ids": ["focus-be564984"],
      "reason": "The element's outline, box-shadow, border, background, color, and underline were identical with and without keyboard focus, confirming the focused state is invisible.",
      "who_is_affected": "Keyboard users cannot tell which element is active without a visible focus indicator and may become disoriented navigating the quiz level options.",